{
  "schema": "feed.case/0.1",
  "caseId": "cubic-conductivity",
  "name": "Synthetic composite pin (illustrative numbers, not a real fuel design)",
  "label": "synthetic",
  "assumptions": {
    "thermalOnly": true,
    "steadyState": true,
    "geometry": "1D-radial"
  },
  "geometry": {
    "fuelRadius": {
      "value": 4.1,
      "unit": "mm"
    },
    "claddingInnerRadius": {
      "value": 4.18,
      "unit": "mm"
    },
    "claddingOuterRadius": {
      "value": 4.75,
      "unit": "mm"
    }
  },
  "power": {
    "linearHeatRate": {
      "value": 20,
      "unit": "kW/m"
    },
    "radialShape": "uniform"
  },
  "boundary": {
    "bulkTemperature": {
      "value": 573,
      "unit": "K"
    },
    "heatTransferCoefficient": {
      "value": 30000,
      "unit": "W/m2/K"
    }
  },
  "materials": {
    "fuel": {
      "materialId": "synthetic-fuel",
      "revision": 1,
      "sets": {
        "thermal.conductivity": {
          "model": "polynomial",
          "a": {
            "value": 2,
            "unit": "W/m/K"
          },
          "b": {
            "value": 0.003,
            "unit": "W/m/K2"
          },
          "c": {
            "value": -0.0000012,
            "unit": "W/m/K3"
          },
          "d": {
            "value": 2e-10,
            "unit": "W/m/K4"
          },
          "validRange": {
            "min": {
              "value": 500,
              "unit": "K"
            },
            "max": {
              "value": 2500,
              "unit": "K"
            }
          },
          "source": "synthetic: a cubic chosen to exercise the polynomial model"
        }
      }
    },
    "cladding": {
      "materialId": "synthetic-cladding",
      "revision": 1,
      "sets": {
        "thermal.conductivity": {
          "model": "constant",
          "value": {
            "value": 15,
            "unit": "W/m/K"
          },
          "referenceTemperature": {
            "value": 600,
            "unit": "K"
          },
          "source": "synthetic: chosen for the closed-form oracle, not a sourced property"
        }
      }
    }
  },
  "gap": {
    "model": "constant-conductance",
    "conductance": {
      "value": 5000,
      "unit": "W/m2/K"
    },
    "source": "synthetic: chosen for the closed-form oracle"
  },
  "mesh": {
    "fuelCells": 100,
    "claddingCells": 20
  }
}
